{
  "$schema": "https://json-schema.org/draft/2020-12/schema",
  "title": "TransitJSON Fare",
  "description": "Ücret tanımı. Her hat/kategori kombinasyonu için ayrı kayıt oluşturulur. tariff_group aktarma indirimi hesabında kullanılır (transfer_rule.schema.json). refund nesnesi BursaRay tarzı çıkış iadesi içindir ve aktarmadan tamamen bağımsızdır.",
  "type": "object",
  "properties": {
    "fare_id": {
      "type": "string",
      "description": "Proje genelinde tekil. Örn. 'BUR-BURSARAY-TAM', 'BUR-OTOBUS-OGRENCI'."
    },
    "agency_id": {
      "type": "string",
      "description": "Bu ücretin ait olduğu ajans."
    },
    "name": {
      "type": "object",
      "properties": {
        "tr": { "type": "string" },
        "en": { "type": "string" }
      },
      "required": ["tr"],
      "additionalProperties": { "type": "string" },
      "description": "Çoklu dil isim nesnesi. 'tr' zorunludur."
    },
    "fare_type": {
      "type": "string",
      "enum": ["flat", "stop_count"],
      "description": "flat: sabit ücret (tüm hat boyunca aynı fiyat). stop_count: durak sayısına göre kademeli ücret."
    },
    "category": {
      "type": "string",
      "description": "Ücret kategorisi. Standart değerler: standard (tam/normal), reduced (indirimli), student (öğrenci), child (çocuk), senior (65 yaş üzeri), disabled (engelli), teacher (öğretmen), veteran (gazi/şehit yakını), bank_card (kredi/banka kartı), free (ücretsiz).",
      "examples": [
        "standard",
        "reduced",
        "student",
        "child",
        "senior",
        "disabled",
        "teacher",
        "veteran",
        "bank_card",
        "free"
      ]
    },
    "tariff_group": {
      "type": ["integer", "null"],
      "minimum": 0,
      "description": "Bu ücretin ait olduğu tarife grubu (0, 1, 2... 9). Aktarma indirimi hesabında kullanılır (transfer_rule.from_tariff_groups). null = tarife grubu tanımlı değil."
    },
    "route_ids": {
      "type": ["array", "null"],
      "items": { "type": "string" },
      "description": "Bu ücretin geçerli olduğu hatlar (routes.json içindeki route_id'lere referans). null = ajansın tüm hatlarında geçerli."
    },
    "price": {
      "type": "number",
      "minimum": 0,
      "description": "Biniş ücreti. flat tipinde sabit fiyat. stop_count tipinde baz (tavan) fiyat."
    },
    "currency": {
      "type": "string",
      "pattern": "^[A-Z]{3}$",
      "description": "ISO 4217 para birimi kodu. Örn. 'TRY', 'EUR', 'USD'."
    },
    "payment_methods": {
      "type": "array",
      "items": {
        "type": "string",
        "enum": [
          "cash",
          "smart_card",
          "credit_card",
          "mobile",
          "contactless",
          "qr"
        ]
      },
      "description": "Kabul edilen ödeme yöntemleri. cash: nakit, smart_card: kent kart/akbil, credit_card: kredi/banka kartı, mobile: mobil uygulama, contactless: temassız, qr: QR kod."
    },
    "tiers": {
      "type": ["array", "null"],
      "description": "fare_type=stop_count için kademeli fiyat tablosu. Sıralı olmalıdır. flat tip için null veya yazılmaz.",
      "items": {
        "type": "object",
        "properties": {
          "min_stops": {
            "type": "integer",
            "minimum": 1,
            "description": "Bu kademenin başladığı minimum durak sayısı."
          },
          "max_stops": {
            "type": ["integer", "null"],
            "minimum": 1,
            "description": "Bu kademenin bittiği maksimum durak sayısı. null = ve üzeri."
          },
          "price": {
            "type": "number",
            "minimum": 0,
            "description": "Bu kademedeki net ücret."
          }
        },
        "required": ["min_stops", "price"],
        "additionalProperties": false
      }
    },
    "refund": {
      "type": ["object", "null"],
      "description": "Çıkış iadesi (BursaRay 'Gittiğin Kadar Öde' tarzı). Aktarmadan tamamen bağımsız bir mekanizma. null = iade yok.",
      "properties": {
        "only_first_leg": {
          "type": "boolean",
          "description": "true ise iade sadece bu hat ilk biniş olduğunda verilir. Aktarmayla geldiysen iade yok."
        },
        "duration_minutes": {
          "type": "integer",
          "minimum": 0,
          "description": "İade validatörüne okutma süresi (dakika). Biniş anından itibaren."
        },
        "eligible_categories": {
          "type": "array",
          "items": { "type": "string" },
          "description": "Hangi yolcu kategorileri iade alabilir. Örn. ['standard']."
        },
        "excluded_route_ids": {
          "type": ["array", "null"],
          "items": { "type": "string" },
          "description": "İade sistemine dahil olmayan hatlar. Örn. T2 tramvay. null = istisna yok."
        },
        "tiers": {
          "type": "array",
          "description": "Durak sayısına göre iade miktarı tablosu.",
          "minItems": 1,
          "items": {
            "type": "object",
            "properties": {
              "min_stops": {
                "type": "integer",
                "minimum": 1
              },
              "max_stops": {
                "type": ["integer", "null"],
                "minimum": 1
              },
              "amount": {
                "type": "number",
                "minimum": 0,
                "description": "İade miktarı."
              }
            },
            "required": ["min_stops", "amount"],
            "additionalProperties": false
          }
        }
      },
      "required": [
        "only_first_leg",
        "duration_minutes",
        "eligible_categories",
        "tiers"
      ],
      "additionalProperties": false
    },
    "updated_at": {
      "type": "string",
      "format": "date-time"
    }
  },
  "required": [
    "fare_id",
    "agency_id",
    "name",
    "fare_type",
    "category",
    "price",
    "currency",
    "updated_at"
  ],
  "if": {
    "properties": {
      "fare_type": { "const": "stop_count" }
    }
  },
  "then": {
    "required": ["tiers"],
    "properties": {
      "tiers": {
        "type": "array",
        "minItems": 1
      }
    }
  },
  "additionalProperties": false
}